<?xml version="1.0" encoding="UTF-8"?>
<xs:schema xmlns:xs="http://www.w3.org/2001/XMLSchema">

  <!-- Root element -->
  <xs:element name="tasks">
    <xs:complexType>
      <xs:sequence>
        <xs:element name="task" maxOccurs="unbounded" minOccurs="1">
          <xs:complexType>
            <xs:sequence>
              <xs:element name="description" type="xs:string" />
              <xs:element name="commands" minOccurs="1" maxOccurs="1">
                <xs:complexType>
                  <xs:sequence>
                    <xs:element name="command" type="xs:string" maxOccurs="unbounded" minOccurs="1"/>
                  </xs:sequence>
                </xs:complexType>
              </xs:element>
              <xs:element name="criteria" minOccurs="0" maxOccurs="1">
                <xs:complexType>
                  <xs:sequence>
                    <xs:element name="criterion" type="xs:string" maxOccurs="unbounded" minOccurs="1"/>
                  </xs:sequence>
                </xs:complexType>
              </xs:element>
              <xs:element name="notes" type="xs:string" minOccurs="0" />
            </xs:sequence>
            <xs:attribute name="id" type="xs:string" use="required" />
            <xs:attribute name="type" type="xs:string" use="required" />
            <xs:attribute name="priority" type="xs:string" use="optional" default="medium" />
            <xs:attribute name="status" type="xs:string" use="optional" default="pending" />
            <xs:attribute name="created" type="xs:dateTime" use="optional" />
            <xs:attribute name="modified" type="xs:dateTime" use="optional" />
          </xs:complexType>
        </xs:element>
      </xs:sequence>
    </xs:complexType>
  </xs:element>

</xs:schema>
